{
  "system": "dnd5e",
  "document": "srd-5.2.1",
  "origin": "official",
  "pages": [
    132
  ],
  "section": "Spells/Spell Descriptions/Fireball",
  "license": {
    "id": "CC-BY-4.0",
    "attribution": "This work includes material from the System Reference Document 5.2.1 (“SRD 5.2.1”) by Wizards of the Coast LLC, available at https://www.dndbeyond.com/srd. The SRD 5.2.1 is licensed under the Creative Commons Attribution 4.0 International License, available at https://creativecommons.org/licenses/by/4.0/legalcode."
  },
  "extracted_by": "L20"
}
